{"$schema":"http://json-schema.org/draft-07/schema#","$id":"https://beta.api.schemas.serto.id/v1/public/simple/1.0/json-schema.json","$metadata":{"slug":"dummy","version":"1.0","icon":"ðŸ…¢","discoverable":false,"uris":{"jsonLdContextPlus":"https://beta.api.schemas.serto.id/v1/public/simple/1.0/ld-context-plus.json","jsonLdContext":"https://beta.api.schemas.serto.id/v1/public/simple/1.0/ld-context.json","jsonSchema":"https://beta.api.schemas.serto.id/v1/public/simple/1.0/json-schema.json"}},"title":"Dummy","description":"A simple credential definition used for testing","type":"object","required":["@context","type","issuer","issuanceDate","credentialSubject"],"properties":{"@context":{"type":["string","array","object"]},"id":{"type":"string","format":"uri"},"type":{"type":["string","array"],"items":{"type":"string"}},"issuer":{"type":["string","object"],"format":"uri","required":["id"],"properties":{"id":{"type":"string","format":"uri"}}},"issuanceDate":{"type":"string","format":"date-time"},"expirationDate":{"type":"string","format":"date-time"},"credentialSubject":{"type":"object","required":["id"],"properties":{"id":{"title":"Credential Subject ID","type":"string","format":"uri"},"name":{"title":"Name","description":"The name","type":"string"},"age":{"title":"Age","description":"The Age","type":"string"}}},"credentialSchema":{"type":"object","required":["id","type"],"properties":{"id":{"type":"string","format":"uri"},"type":{"type":"string"}}}}}