{"@context":["https://www.w3.org/2018/credentials/v1","https://resolver.cc/context/did:cosmos:elesto:dummy"],"id":"https://test.xyz/credential/1","type":["VerifiableCredential","DummyCredential"],"issuer":"did:cosmos:key:elesto17t8t3t6a6vpgk69perfyq930593sa8dnfl98mr","issuanceDate":"2022-06-02T14:13:00Z","credentialSubject":{"age":"42","id":"did:cosmos:key:elesto17t8t3t6a6vpgk69perfyq930593sa8dnfl98mr","name":"Arthur Dent"}}
